{
  "bundle": {
    "constructs": [
      {
        "id": "Order",
        "initial": "draft",
        "kind": "Entity",
        "provenance": {
          "file": "manifest_basic.tenor",
          "line": 5
        },
        "states": [
          "draft",
          "submitted",
          "approved"
        ],
        "tenor": "1.0",
        "transitions": [
          {
            "from": "draft",
            "to": "submitted"
          },
          {
            "from": "submitted",
            "to": "approved"
          }
        ]
      }
    ],
    "id": "manifest_basic",
    "kind": "Bundle",
    "tenor": "1.0",
    "tenor_version": "1.0.0"
  },
  "capabilities": {
    "migration_analysis_mode": "conservative"
  },
  "etag": "d0e189b7f0e6bb674eca2ff978e8b4382e16c928909e415b6cde5865b55b1a16",
  "tenor": "1.0"
}
